category,question,purpose,answer
Design,지원자님의 삶에서 힘들었던 점이 무엇인지 또 그것을 어떻게 극복했는지 말씀해 주시겠어요?,지원자의 디자인 철학과 접근 방식을 이해하기 위함,"가장 힘들었던 순간은 대학교 때 프로젝트에서 팀원들과의 의견 충돌로 어려움을 겪었을 때입니다. 마치 디자인 시스템에서 요소들이 충돌하는 것처럼, 서로의 의견이 맞지 않았죠. 하지만 저는 그리드 시스템을 활용하듯 팀원들의 의견을 정리하고, 일관된 구조로 협력할 수 있는 방법을 찾아 해결했습니다."
Design,"일을 하다 보면 자연스럽게 스트레스가 쌓이게 됩니다. 그 스트레스를 어떻게 해소하느냐에 따라 다시 일할 수 있는 힘을 얻게 되는데, 지원자님만의 스트레스를 해소하는 방법이 있다면 그것에 대해서 말씀해 주세요.",새로운 도전과 변화에 대한 유연성을 평가하기 위함,"스트레스는 마치 디자인 프로세스에서 예상치 못한 오류가 발생하는 것과 같습니다. 저는 스트레스를 해소하기 위해 잠시 화면에서 벗어나, 자연 속에서 리프레임을 시도합니다. 그렇게 하면 복잡했던 문제를 새로운 시각에서 다시 바라볼 수 있게 되고, 최적의 디자인 솔루션을 찾는 것처럼 스트레스가 해소됩니다."
Design,디자인을 하실 때 본인이 가장 중요하게 여기는 것이 무엇인가요?,디자인 과정에서 문제 해결 능력을 파악하기 위함,"저는 사용자 경험(UX)을 가장 중요하게 생각합니다. 디자인은 단순한 미적 요소가 아닌, 사용자의 감각적 흐름을 고려해야 하죠. 마치 와이어프레임이 웹사이트의 전체 흐름을 결정하는 것처럼, 사용자 경험을 기반으로 디자인이 자연스럽게 이어질 수 있도록 구성하는 것이 중요합니다."
Design,만약 지원자님께서 지원하신 직무가 아닌 다른 부서에 배치된다면 어떻게 하시겠습니까?,디자인 트렌드에 대한 이해도와 인사이트를 확인하기 위함,"새로운 부서로 배치되는 것은 마치 리디자인을 하는 것과 같습니다. 기존에 익숙한 틀에서 벗어나 새로운 틀을 적용해야 하지만, 그 과정에서 더 나은 구조를 발견할 수 있습니다. 저는 모듈화된 사고방식을 적용하여 어디서든 쉽게 적응하고 성장할 수 있습니다."
Design,인생에서 가장 후회되는 일은 무엇입니까?,창의적인 아이디어를 실현하는 과정을 설명할 수 있는지를 평가하기 위함,"가장 후회되는 일은 프로젝트에서 충분한 리서치를 하지 않아 디자인이 사용자 기대에 부합하지 못했던 경험입니다. 마치 디자인 시스템이 불안정할 때 발생하는 불일치처럼, 그 경험은 저에게 데이터 기반 디자인의 중요성을 일깨워 주었습니다. 그 후로는 사용자 조사를 통해 데이터 기반으로 결정을 내리는 습관을 들였습니다."
Design,커뮤니케이션을 잘할 수 있는 본인만의 스킬이 있으신가요?,지원자의 시각적 표현 능력과 기술 숙련도를 평가하기 위함,"저는 팀원들과의 커뮤니케이션을 마치 디자인 피드백 세션처럼 접근합니다. 먼저 팀원들의 의견을 경청하고, 각자의 시각적 아이디어가 어떻게 프로젝트에 기여할 수 있을지 분석한 후 피드백을 제공합니다. 이러한 과정은 마치 디자인 리뷰를 통해 더 나은 최종안을 도출하는 것과 같습니다."
Design,지원자님께서는 휴식을 취할 때 주로 어떤 일들을 하십니까?,팀 프로젝트에서의 협업 경험과 역할을 이해하기 위함,"저는 휴식을 취할 때 브레인스토밍을 주로 합니다. 특히 일상 속에서 눈에 띄는 패턴이나 색상을 관찰하며, 그로부터 디자인 아이디어를 얻습니다. 이는 마치 디자인 스프린트의 초기 단계처럼, 큰 틀을 잡기 위한 영감을 받는 시간입니다."
Design,디자인 작업에서 영감을 얻는 방법은 무엇인가요?,디자인 작업에서의 시간 관리 및 우선순위 설정 능력을 파악하기 위함,"저는 타이포그래피와 같은 세부적인 요소에서 영감을 많이 받습니다. 작은 디테일이 디자인 전체의 균형을 결정짓는 것처럼, 저는 사소해 보이는 요소들이 어떻게 전체적인 디자인 흐름에 영향을 미치는지 관찰하며 영감을 얻습니다. 이러한 요소들이 조화를 이루는 순간, 비로소 완벽한 디자인이 탄생한다고 믿습니다."
Design,무형 문화유산 보호에 대한 생각은?,디자인과 관련된 피드백을 수용하고 적용하는 태도를 평가하기 위함,"무형 문화유산은 마치 브랜드 아이덴티티와 같습니다. 그것이 우리의 정체성을 정의하고, 미래 세대에게 전승됩니다. 무형 문화유산을 보호하는 것은, 브랜드가 지속적으로 일관성을 유지하며 진화하는 것과 같다고 생각합니다. 이를 위해서는 지속 가능한 디자인처럼, 장기적인 관점에서 보호와 전승이 이루어져야 합니다."
Design,팀장 역할과 팀원 역할 중 어떤 것이 본인에게 더 맞는지 말씀해 주세요.,자신의 디자인 작업이 사용자 경험에 미치는 영향을 이해하는지를 확인하기 위함,"저는 팀장 역할이 저에게 잘 맞다고 생각합니다. 팀장은 마치 디자인 프로젝트의 아트 디렉터와 같아, 전체적인 비전을 설정하고 팀원들이 그 비전을 실현할 수 있도록 지원하는 역할을 합니다. 하지만 상황에 따라 디자인 시스템 내의 한 요소처럼 팀원으로서 협력하는 것도 중요하다고 생각합니다."
ICT,저희 회사에 들어오시게 된다면 가장 가고 싶었던 부서와 이유는 무엇입니까?,지원자가 선호하는 부서를 통해 관심 분야와 장기적인 목표를 파악하기 위함,"저는 네트워크 보안 부서에 가장 가고 싶습니다. 네트워크 보안은 마치 정보의 방화벽처럼, 회사의 모든 데이터와 시스템을 안전하게 보호하는 역할을 하기 때문입니다."
ICT,타 직무에 배치된다면 어떻게 하시겠습니까?,지원자의 유연성과 다른 직무에 대한 적응력을 평가하기 위함,"다른 부서에 배치된다면, 마치 분산 시스템처럼 각기 다른 부서에서도 협력하여 전체 시스템이 원활히 작동하도록 할 수 있습니다."
ICT,창의적으로 문제를 해결한 경험이 있습니까?,창의적인 문제 해결 능력을 갖추고 있는지를 확인하기 위함,서버 과부하 문제를 로드 밸런싱을 통해 해결한 경험이 있습니다. 이를 통해 트래픽을 분산시키고 서버의 안정성을 확보했습니다.
ICT,최근 정보 보안 관련 이슈에 대해 알고 계십니까?,정보 보안에 대한 최신 이슈와 지식 수준을 평가하기 위함,최근 랜섬웨어 공격이 전 세계적으로 큰 이슈였습니다. 특히 공급망 공격을 통해 한 번의 침투로 다수의 시스템을 감염시키는 방식이 매우 위험하다고 생각합니다.
ICT,글로벌 인재에게 필요한 요소는 무엇이라고 생각합니까?,글로벌 인재로서 필요한 역량과 지원자의 준비 과정을 파악하기 위함,글로벌 인재에게 필요한 요소는 문화적 민감성과 글로벌 사고방식이라고 생각합니다. 다양한 문화 속에서도 원활하게 소통할 수 있어야 합니다.
ICT,쉬는 날에는 무엇을 하십니까?,지원자의 협업 능력과 팀워크 성향을 확인하기 위함,쉬는 날에는 코딩이나 네트워크 설정을 시도하며 새로운 기술을 학습합니다. 이를 통해 제 기술을 업그레이드하고 문제 해결 능력을 키웁니다.
ICT,업무와 무관한 일을 상사가 시킨다면 어떻게 하시겠습니까?,지원자의 문제 해결 접근 방식을 파악하기 위함,업무와 직접 관련이 없는 일이라도 마치 백그라운드 프로세스처럼 회사 전체에 영향을 줄 수 있다고 생각합니다. 상황에 맞게 처리하겠습니다.
ICT,협업에서 가장 중요하다고 생각하는 것은 무엇입니까?,스트레스 상황에서의 대처 능력을 평가하기 위함,협업에서 가장 중요한 것은 명확한 의사소통입니다. 각 팀원이 같은 목표를 향해 협력해야만 프로젝트가 성공적으로 완성됩니다.
ICT,"직무 지식, 역량, 태도 중 가장 중요하다고 생각하는 것은 무엇입니까?",자신의 강점을 어떻게 활용하는지를 확인하기 위함,"직무 태도가 가장 중요하다고 생각합니다. 지식과 역량은 학습할 수 있지만, 긍정적인 태도는 성과에 직접적인 영향을 미칩니다."
ICT,야근과 외근이 많아도 괜찮으십니까?,회사의 가치와 문화에 대한 이해도를 평가하기 위함,야근이나 외근은 마치 서버 유지 보수와 같다고 생각합니다. 안정성을 위해 추가 작업이 필요하다면 기꺼이 수행할 준비가 되어 있습니다.
Management,문서화는 왜 해야 한다고 생각하십니까?,지원자의 리더십 스타일과 팀 관리 능력을 평가하기 위함,문서화는 마치 프로세스 매뉴얼과 같습니다. 모든 사람이 동일한 기준과 절차에 따라 업무를 수행할 수 있도록 가이드라인을 제공하죠.
Management,타 지역에서 업무를 수행할 수 있습니까?,변화하는 상황에서의 적응력과 문제 해결 능력을 파악하기 위함,"타 지역에서의 업무는 마치 프로젝트 관리에서 새로운 리소스를 할당받는 것과 같습니다. 환경은 다르지만, 핵심 프로세스는 동일하기 때문에 문제가 없습니다."
Management,"네이버, 다음, 구글 검색을 비교해 주세요.",조직 내에서 갈등을 해결하고 협업을 촉진하는 능력을 확인하기 위함,"네이버와 다음은 국내 맞춤형 서비스이고, 구글은 글로벌 표준으로 방대한 데이터를 제공합니다. 이는 마치 로컬 전략과 글로벌 전략의 차이와 같습니다."
Management,의견을 강하게 주장하는 편입니까?,관리자의 역할에서 의사결정 과정과 책임감을 평가하기 위함,저는 의견을 강하게 주장하기보다는 데이터 기반으로 설득력 있게 논리적으로 접근하는 방식을 선호합니다.
Management,현대사회에서 없어서는 안 될 필수 직업은 무엇입니까?,팀의 성과를 극대화하기 위한 전략적 사고 능력을 이해하기 위함,프로젝트 매니저는 현대사회에서 필수적인 직업입니다. 마치 오케스트라의 지휘자처럼 다양한 자원을 조율해 목표를 달성하는 중요한 역할을 합니다.
Management,면접 준비를 위해 무엇을 하셨습니까?,지원자의 커뮤니케이션 스타일과 피드백 제공 방식을 파악하기 위함,"저는 SWOT 분석을 통해 회사의 강점과 기회를 파악하고, 제가 기여할 수 있는 부분을 분석했습니다."
Management,전략적 경영을 위한 신사업 아이디어가 있습니까?,프로젝트 관리와 일정 조율 능력을 평가하기 위함,디지털 전환과 데이터 기반 경영을 활용한 신사업 아이디어를 제안하고 싶습니다. 이를 통해 경쟁 우위를 확보할 수 있다고 생각합니다.
Management,내일 죽는다면 오늘 뭐 하시겠습니까?,목표 설정과 그 달성을 위한 계획 수립 능력을 확인하기 위함,"내일 죽는다면 오늘은 제 지식과 경험을 문서화하여 남길 것입니다. 마치 지식 관리 시스템처럼, 후대에 남기고 싶습니다."
Management,물류 쪽에서 필요한 역량은 무엇입니까?,지원자가 겪은 가장 큰 관리적 도전과 그 해결 방법을 파악하기 위함,물류에서 중요한 역량은 리드 타임을 최소화하고 재고 관리를 통해 비용 절감을 실현하는 능력입니다.
Management,글로벌 인재에게 필요한 요소는 무엇입니까?,조직의 가치와 문화에 대한 이해도를 평가하기 위함,글로벌 인재에게 중요한 요소는 문화적 민감성과 글로벌 사고방식입니다. 다양한 문화적 배경에서 소통할 수 있어야 합니다.
Public Service,창의성과 팀워크 중 더 중요한 것은 무엇이라고 생각하나요?,공공 서비스에 대한 이해도와 지원자의 사명감을 평가하기 위함,"저는 팀워크가 더 중요하다고 생각합니다. 공공 서비스는 마치 도시의 인프라처럼, 모든 부서가 협력하여 하나의 목표를 이루어야 합니다."
Public Service,창의적으로 문제를 해결한 경험이 있으십니까?,지역사회와의 소통 능력 및 문제 해결 역량을 파악하기 위함,저는 지역사회 프로젝트에서 예산 부족 문제를 창의적으로 해결하기 위해 공공-민간 협력 방안을 도입한 경험이 있습니다.
Public Service,특별히 가고 싶은 회사가 있습니까?,정책 실행과 관련된 판단력 및 윤리 의식을 평가하기 위함,"저는 사회적 가치를 중시하는 회사에 가고 싶습니다. 마치 커뮤니티 기반 조직처럼, 지역 사회와의 소통을 중요시하는 회사를 선호합니다."
Public Service,이 분야에 관심을 가지게 된 계기는 무엇입니까?,공공 서비스 분야에서의 협업 능력을 확인하기 위함,"사회적 가치 창출에 관심이 많아 이 분야에 뛰어들게 되었습니다. 공공 서비스는 사회의 안전망 역할을 하며, 모두에게 기회를 제공합니다."
Public Service,평소 검색을 많이 하십니까?,지원자가 공공의 이익을 위해 일할 준비가 되어 있는지를 평가하기 위함,"저는 문제 해결을 위해 자주 검색을 합니다. 마치 데이터 기반 의사결정을 위해 신뢰할 수 있는 정보를 찾아내는 것처럼, 저는 항상 정확한 정보를 찾습니다."
Public Service,가장 후회되는 일은 무엇입니까?,공공 서비스의 변화와 발전에 대한 이해도를 확인하기 위함,가장 후회되는 일은 지역사회 봉사 프로젝트에 더 많은 시간을 할애하지 못한 것입니다. 더 많은 노력을 기울였더라면 큰 성과를 낼 수 있었을 것이라 생각합니다.
Public Service,지원한 분야에 대해 1분간 소개해 보세요.,지원자의 사회적 책임감과 공익에 대한 관심을 파악하기 위함,"제가 지원한 공공 서비스 분야는 시민의 삶을 직접적으로 개선하는 역할을 하며, 정부와 시민 간의 신뢰 관계를 구축하는 것이 중요합니다."
Public Service,책을 읽는 것을 좋아하십니까? 최근에 읽은 책이 있다면 소개해 주세요.,정책의 지속 가능성과 실행 가능성에 대한 지원자의 의견을 평가하기 위함,"저는 책을 읽는 것을 좋아하며, 최근에는 공공 서비스 혁신에 관한 책을 읽고 있습니다. 이 책은 공공 서비스의 효율성을 높이는 다양한 사례를 다룹니다."
Public Service,고객 불만이 발생했을 때 어떻게 대응하시겠습니까?,지원자의 리더십과 팀 관리 능력을 확인하기 위함,"고객 불만은 공공 서비스의 만족도 평가와 같습니다. 저는 먼저 신속하게 문제를 파악하고, 투명하게 소통하며 해결책을 제시하려고 노력합니다."
Public Service,배달의 민족 서비스를 사용하면서 불편했던 점은 무엇입니까?,복잡한 문제에 대한 체계적 접근 및 해결 능력을 평가하기 위함,"배달의 민족은 매우 편리한 서비스지만, 지역 상생에 대한 기여가 부족한 것 같습니다. 더 많은 지역 자영업자 지원을 기대합니다."
R&D,입사하면 어떤 사람이 되고 싶나요?,연구 및 개발에 대한 지원자의 열정과 이해도를 평가하기 위함,"저는 입사 후 혁신을 이끄는 촉매가 되고 싶습니다. 마치 촉매가 반응 속도를 촉진시키듯, 저는 팀 내에서 새로운 아이디어를 빠르게 실현시키고 싶습니다."
R&D,"직무 지식, 역량, 태도 중 가장 중요하다고 생각하는 것은 무엇입니까?",기술적 문제 해결 능력과 창의성을 파악하기 위함,저는 직무 태도가 가장 중요하다고 생각합니다. 새로운 기술을 탐구하는 과정에서 긍정적인 태도가 결국 혁신을 이루는 열쇠라고 믿습니다.
R&D,신용보증기금이 확대해야 할 업무 영역은 무엇이라고 생각합니까?,지원자가 최신 기술 동향을 얼마나 잘 이해하고 있는지를 확인하기 위함,"신용보증기금은 마치 스타트업의 연구개발 투자처럼, 기술 기반 기업들이 자금을 원활하게 공급받아 혁신을 촉진할 수 있도록 지원해야 한다고 생각합니다."
R&D,지원한 분야에 대해 간단히 소개해 주세요.,연구 결과를 실용화하는 과정에서의 전략적 사고를 평가하기 위함,"제가 지원한 R&D 분야는 새로운 기술을 연구하고 상용화하는 역할을 담당하며, 특히 실험적 검증과 프로토타입 개발이 중요한 핵심 업무입니다."
R&D,진행 중인 프로젝트가 있습니까?,지속 가능한 기술 개발에 대한 이해도를 파악하기 위함,저는 딥러닝 알고리즘을 활용한 데이터 분석 프로젝트를 진행 중입니다. 이를 통해 실시간 데이터를 처리하고 예측 모델의 정확성을 높이는 데 주력하고 있습니다.
R&D,커뮤니케이션 스킬을 소개해 주세요.,팀 내에서 연구를 진행할 때의 협업 능력을 평가하기 위함,저는 복잡한 기술적 개념을 쉽게 설명하는 커뮤니케이션 스킬을 가지고 있습니다. 이는 팀 내에서 기술적 소통을 원활하게 하는 데 큰 도움이 됩니다.
R&D,회사와 본인의 연관성을 설명해 주세요.,연구 목표 설정과 그 달성을 위한 계획 수립 능력을 확인하기 위함,저는 회사가 기술적 진보를 이루는 과정에서 핵심적인 역할을 하고 싶습니다. 마치 연구개발이 회사의 성장 엔진이 되듯이 말이죠.
R&D,업무와 무관한 일을 맡게 된다면 어떻게 하시겠습니까?,지원자의 연구 성과를 설명하고 활용하는 능력을 평가하기 위함,"업무와 무관한 일이 주어지더라도, 이를 새로운 학습의 기회로 삼아 해결할 방법을 찾을 것입니다."
R&D,적성에 맞지 않는 직무를 맡게 된다면 어떻게 하시겠습니까?,기술적 혁신에 대한 지원자의 관점과 준비성을 파악하기 위함,"적성에 맞지 않는 직무라도 저는 학습과 적응을 통해 극복할 수 있다고 생각합니다. 마치 새로운 기술을 배우는 과정처럼, 노력으로 해결할 수 있다고 믿습니다."
R&D,이룬 성과 중 가장 큰 성과는 무엇입니까?,연구 및 개발 프로젝트에서의 리더십을 확인하기 위함,제가 가장 자랑스러워하는 성과는 멀티 변수 실험을 성공적으로 마치고 최적화된 솔루션을 도출해낸 것입니다.
Production & Manufacturing,동물 실험에 대한 지원자님의 생각은 무엇입니까?,지원자의 생산 관리 능력과 효율성 향상을 위한 전략을 평가하기 위함,"동물 실험은 마치 초기 제품 테스트와 같습니다. 필요할 때가 있지만, 궁극적으로 대체 방법을 찾는 것이 중요하다고 생각합니다."
Production & Manufacturing,다른 직무를 맡게 된다면 어떻게 하시겠습니까?,생산 현장에서의 문제 해결 능력과 신속한 대응 능력을 파악하기 위함,"다른 직무를 맡게 된다면, 마치 공정 개선 과정에서 새로운 도전과제를 해결하는 것처럼 적극적으로 배우고 적응하겠습니다."
Production & Manufacturing,무형 문화유산 보호에 대한 생각은 무엇입니까?,품질 관리와 관련된 이해도와 지속적인 개선 노력에 대해 평가하기 위함,"무형 문화유산은 마치 기업의 전통적인 생산 방식처럼, 지속적인 보호와 보존이 필요하다고 생각합니다."
Production & Manufacturing,직무 수행 시 난관에 봉착했다면 어떻게 해결하시겠습니까?,공정 최적화 및 비용 절감 전략을 수립할 수 있는지를 확인하기 위함,"난관에 봉착했을 때는 문제의 근본 원인을 파악하고, 마치 병목 현상을 해결하는 것처럼 최적의 해결책을 찾아 나가야 한다고 생각합니다."
Production & Manufacturing,협업에서 가장 중요하게 생각하는 것은 무엇입니까?,제조 과정에서의 안전 관리 및 리스크 대응 능력을 평가하기 위함,"협업에서 가장 중요한 것은 각자의 역할을 명확히 하고, 마치 생산 라인의 기계들처럼 유기적으로 협력하는 것입니다."
Production & Manufacturing,해외 출장을 선택할 수 있다면 어느 나라로 가고 싶습니까?,지원자의 팀워크 및 협업 능력을 파악하기 위함,"저는 독일로 가고 싶습니다. 독일은 제조업 혁신의 중심지이며, 그곳에서 첨단 제조 기술을 배우고 싶습니다."
Production & Manufacturing,난관을 해결하기 위한 아이디어를 제안한 적이 있습니까?,생산 목표 달성을 위한 계획 수립 및 실행 능력을 이해하기 위함,"공정 효율성이 떨어진 문제를 해결하기 위해, TPM(Total Productive Maintenance)을 제안하고 예방 정비를 도입한 경험이 있습니다."
Production & Manufacturing,"특정 회사를 중시하는지, 회사 분위기를 중요시하는지 말씀해 주세요.",신기술 도입 및 자동화 관련 지식을 평가하기 위함,"저는 회사의 도메인도 중요하지만, 특히 혁신적이고 도전적인 기업 문화를 더욱 중시합니다."
Production & Manufacturing,목표를 세우고 달성한 경험이 있습니까?,지원자의 리더십과 팀 관리 능력을 확인하기 위함,"저는 Lean Manufacturing을 바탕으로 생산성을 향상시킨 경험이 있으며, 2년간 꾸준히 개선하여 목표를 달성했습니다."
Production & Manufacturing,직무 수행 시 가장 중요한 역량은 무엇이라고 생각하십니까?,생산 현장에서의 커뮤니케이션 능력과 갈등 해결 능력을 평가하기 위함,"직무 수행 시 가장 중요한 역량은 생산 효율성을 높이고, 품질 관리를 철저히 하는 능력이라고 생각합니다."
Sales & Marketing,협업에서 가장 어려웠던 점과 해결법은 무엇입니까?,지원자의 고객 이해도와 시장 분석 능력을 평가하기 위함,"가장 어려웠던 협업 경험은 마치 다양한 고객 세그먼트를 대상으로 하는 타겟팅 캠페인과 같았습니다. 각 팀원이 다른 의견을 가지고 있어 일관된 전략을 세우기 힘들었지만, 팀원들의 강점을 파악하여 공통 목표를 재설정하고 협력했습니다."
Sales & Marketing,지원한 직무에 대해 설명해 주세요.,영업 목표 달성을 위한 전략적 사고와 실행 능력을 파악하기 위함,"제가 지원한 직무는 디지털 마케팅입니다. 소셜 미디어와 검색 엔진 최적화를 통해 브랜드 인지도를 높이고, A/B 테스트와 데이터 분석으로 마케팅 효율성을 높이는 역할을 합니다."
Sales & Marketing,동료의 이직 고민이 있을 때 어떻게 조언하시겠습니까?,마케팅 캠페인 기획 능력과 창의성을 평가하기 위함,"이직 고민을 하는 동료에게는 고객 이탈률을 줄이기 위한 전략처럼, 그들의 고민을 듣고 해결 방안을 제시할 것입니다. 이직이 불가피하다면, 결정을 존중하고 응원할 것입니다."
Sales & Marketing,취업 시 중점적으로 보는 부분은 무엇입니까?,지원자의 협상 능력과 대인관계 스킬을 확인하기 위함,"취업 시 저는 브랜드 가치와 회사의 문화적 정체성을 중점적으로 봅니다. 마치 브랜드 아이덴티티처럼, 회사의 비전이 제게 큰 영향을 줍니다."
Sales & Marketing,상사와 트러블이 생겼을 때 어떻게 해결하시겠습니까?,브랜드 관리와 고객 만족도 향상에 대한 이해도를 평가하기 위함,상사와 트러블이 생길 때는 CRM(Customer Relationship Management)처럼 상사의 의견을 경청하고 피드백을 받아들이며 문제를 해결하려고 노력합니다.
Sales & Marketing,개인적으로 공부하는 방법은 무엇입니까?,시장 변화에 대한 적응력과 유연성을 파악하기 위함,저는 콘텐츠 마케팅 전략처럼 목표를 설정하고 학습 자료를 찾아 공부합니다. 주로 온라인 강의와 케이스 스터디를 통해 실무에 바로 적용할 수 있는 방법을 배웁니다.
Sales & Marketing,스트레스를 해소하는 방법은 무엇입니까?,지원자의 커뮤니케이션 능력과 프레젠테이션 스킬을 평가하기 위함,"스트레스를 받을 때는 마치 리타겟팅 광고처럼, 취미나 활동을 통해 다시 에너지를 회복합니다. 잠시 업무에서 벗어나 새로운 시각을 갖는 것이 중요합니다."
